{
  "schemaVersion": 1,
  "id": "docs-platform",
  "name": "Bitcoin Universe documentation platform",
  "classification": "infrastructure",
  "repository": "bitcoinuniverseio/docs-platform",
  "documentationUrl": "https://docs.bitcoinuniverse.io/",
  "docsRoot": "apps/portal/src/content/docs",
  "sourceRef": "main",
  "releasedRef": "7cc126cd8c117e82513828797fe0520528eb8849",
  "releaseVersion": "continuous",
  "lifecycle": "stable",
  "chains": [],
  "audiences": ["user", "app-developer", "protocol-implementer", "indexer-operator", "security-verifier"],
  "specifications": ["packages/content-schema/schemas/docs.manifest.schema.json"],
  "contracts": {
    "jsonSchema": ["packages/content-schema/schemas/docs.manifest.schema.json"]
  },
  "statusSources": [],
  "owners": ["bitcoinuniverseio"],
  "securityClassification": "public",
  "lastVerified": {
    "commit": "7cc126cd8c117e82513828797fe0520528eb8849",
    "timestamp": "2026-09-01T12:25:05Z"
  }
}
